results/comparison_before_after_e2e_copy/01_wsn_multiseed_all_configs.csv

family,student,config,before_n_seeds,before_acc_mean,before_acc_std,before_macro_f1_mean,before_macro_f1_std,before_blackhole_f1,before_flooding_f1,before_grayhole_f1,before_normal_f1,before_tdma_f1,before_params,before_size_kb,after_full10_n_seeds,after_full10_acc_mean,after_full10_acc_std,after_full10_macro_f1_mean,after_full10_macro_f1_std,after_full10_blackhole_f1,after_full10_flooding_f1,after_full10_grayhole_f1,after_full10_normal_f1,after_full10_tdma_f1,delta_macro_f1_full10_minus_before,delta_acc_full10_minus_before,incomplete_n2_n_seeds,incomplete_n2_macro_f1_mean,incomplete_n2_note,in_archived_only,in_trainonly_only,protocol_before,protocol_after
wsn_multiseed_predictive,A,A_RF_500,10,0.996599644128114,5.123195746935403e-05,0.9788888430705942,0.0002514417158354,0.9903957236265056,0.9633025708283366,0.98333289531138,0.998394885464682,0.9590181401220668,,85064.5361328125,10.0,0.9965907473309608,5.943048659491634e-05,0.9788502941560824,0.0002670496364152,0.9903957236265056,0.9632084466225692,0.9832391666967846,0.9983899937124864,0.9590181401220668,-3.854891451182674e-05,-8.896797153212788e-06,2.0,0.9787577841055746,DO_NOT_USE_as_primary,False,False,archived_pre_split_scaler_10seed,train_only_scaler_random_row_10seed
wsn_multiseed_predictive,A,B_Full_MLP,10,0.9873220640569396,0.0003988504714301,0.9231949934342208,0.0023753226388243,0.8686063627222268,0.9385401593405108,0.876712653987872,0.9972290328398546,0.9348867582806392,69893.0,273.01953125,10.0,0.9872633451957296,0.000316061075401,0.9226887762531352,0.0020062386205199,0.8672306992018963,0.9383622154558102,0.8772657449747779,0.9972152442290452,0.9333699774041456,-0.0005062171810856775,-5.871886121000536e-05,2.0,0.9214800806926664,DO_NOT_USE_as_primary,False,False,archived_pre_split_scaler_10seed,train_only_scaler_random_row_10seed
wsn_multiseed_predictive,A,C2_CL_MLP_domain,10,0.9857313167259788,0.0004806543550829,0.9138075716951344,0.0031582214534915,0.8434452108985735,0.9381933485212351,0.8566409038089049,0.99715027827313,0.9336081169738282,69893.0,273.01953125,10.0,0.9856548042704628,0.0007470861411493,0.9131371118601588,0.0045405767015448,0.8425479405398836,0.936425131478382,0.8557025731807391,0.9971443729220324,0.9338655411797572,-0.0006704598349756008,-7.651245551598684e-05,2.0,0.911090216478642,DO_NOT_USE_as_primary,False,False,archived_pre_split_scaler_10seed,train_only_scaler_random_row_10seed
wsn_multiseed_predictive,A,C_CL_MLP_loss,10,0.9858861209964414,0.0006486149542669,0.9147295397337878,0.0039033725301293,0.848594642951632,0.9373032805386472,0.8557640458693282,0.9971758813919612,0.9348098479173697,69893.0,273.01953125,10.0,0.9857259786476869,0.0006639657720638,0.9135861700874944,0.0038551845773975,0.8445725592575479,0.9366087541879942,0.8558451708410644,0.9971551998336606,0.9337491663172052,-0.0011433696462933574,-0.0001601423487544995,2.0,0.9118642964555828,DO_NOT_USE_as_primary,False,False,archived_pre_split_scaler_10seed,train_only_scaler_random_row_10seed
wsn_multiseed_predictive,A,C_CL_MLP_loss_ext,10,0.9786672597864768,0.0237895490864476,0.8672566232448489,0.1548196369474477,0.7735441223368222,0.9193659665323206,0.7793706599142542,0.9960293978633354,0.8679729695775121,69893.0,273.01953125,10.0,0.9785907473309609,0.0252353803987912,0.8674204900984448,0.1616812906197555,0.7702994816450504,0.922391975220462,0.7795825971424906,0.9960697254158462,0.8687586710683748,0.00016386685359592867,-7.651245551598684e-05,2.0,0.9204200327445308,DO_NOT_USE_as_primary,False,False,archived_pre_split_scaler_10seed,train_only_scaler_random_row_10seed
wsn_multiseed_predictive,A,C_CL_MLP_loss_fair,10,0.9858861209964414,0.0006486149542669,0.9147295397337878,0.0039033725301293,0.848594642951632,0.9373032805386472,0.8557640458693282,0.9971758813919612,0.9348098479173697,69893.0,273.01953125,10.0,0.9857259786476869,0.0006639657720638,0.9135861700874944,0.0038551845773975,0.8445725592575479,0.9366087541879942,0.8558451708410644,0.9971551998336606,0.9337491663172052,-0.0011433696462933574,-0.0001601423487544995,2.0,0.9118642964555828,DO_NOT_USE_as_primary,False,False,archived_pre_split_scaler_10seed,train_only_scaler_random_row_10seed
wsn_multiseed_predictive,A,D_Small_MLP,10,0.9847081850533808,0.0021250826434366,0.9123026008546002,0.0062229610520569,0.8486007785069386,0.9363428834005656,0.8467894929344488,0.9964083689428704,0.933371480488178,1189.0,4.64453125,10.0,0.984364768683274,0.0024941382685896,0.910902993186332,0.0068434659889499,0.8471666944766769,0.9355546372749216,0.844835528550109,0.9962484405622648,0.9307096650676884,-0.001399607668268188,-0.00034341637010670834,2.0,0.91048673880095,DO_NOT_USE_as_primary,False,False,archived_pre_split_scaler_10seed,train_only_scaler_random_row_10seed
wsn_multiseed_predictive,A,E2_KD_from_MLP,10,0.9861263345195732,0.0004257133706651,0.9163546313645536,0.0027587524475505,0.8501986770126948,0.9421931506766344,0.8600288437383028,0.9972093767070588,0.9321431086880768,1189.0,4.64453125,10.0,0.9853914590747332,0.0003616572056803,0.9120394941841938,0.0023354268049633,0.8360044179291725,0.9448754862841944,0.8524867798634084,0.9971838060121004,0.9296469808320944,-0.004315137180359807,-0.0007348754448399664,2.0,0.9117384531066964,DO_NOT_USE_as_primary,False,False,archived_pre_split_scaler_10seed,train_only_scaler_random_row_10seed
wsn_multiseed_predictive,A,E_KD_from_RF,10,0.9868754448398576,0.0005172521658411,0.9199713533197722,0.0031241763505348,0.8380575027433327,0.9531032789978972,0.8592567283550266,0.9978972133845344,0.9515420431180704,1189.0,4.64453125,10.0,0.9869430604982206,0.0010661252282702,0.9203444861873752,0.006513084530571,0.8370072850696519,0.9545673368561076,0.8603681451342478,0.997891823767702,0.9518878401091668,0.0003731328676029877,6.76156583629961e-05,2.0,0.922050582689976,DO_NOT_USE_as_primary,False,False,archived_pre_split_scaler_10seed,train_only_scaler_random_row_10seed
wsn_multiseed_predictive,A,F_KD_from_CL_MLP,10,0.9855088967971528,0.0003335717624327,0.9129124186422604,0.0021260766535441,0.8392742568061401,0.9418330122547476,0.8532352690488578,0.9971513002837108,0.9330682548178456,1189.0,4.64453125,10.0,0.9850658362989324,0.0004147642346395,0.9104895552870976,0.00310359067994,0.8331599789560169,0.944617047531734,0.8469502253826784,0.9971434133449476,0.9305771112201112,-0.00242286335516273,-0.0004430604982204045,2.0,0.9094917663110408,DO_NOT_USE_as_primary,False,False,archived_pre_split_scaler_10seed,train_only_scaler_random_row_10seed
wsn_multiseed_predictive,A,F_KD_from_CL_MLP_ext,10,0.9836067615658364,0.0066590564849375,0.906371805793266,0.02510893853073,0.8399431576988972,0.9444547886753116,0.8537650218982433,0.9961187789125512,0.8975772817813278,1189.0,4.64453125,10.0,0.9811743772241992,0.0127046678694523,0.8936578199261115,0.0554210593453872,0.8213237880330633,0.9440185178570648,0.8300457396885402,0.9960617449956214,0.8768393090562675,-0.012713985867154554,-0.0024323843416371727,2.0,0.9111646336802088,DO_NOT_USE_as_primary,False,False,archived_pre_split_scaler_10seed,train_only_scaler_random_row_10seed
wsn_multiseed_predictive,A,F_KD_from_CL_MLP_fair,10,0.9855088967971528,0.0003335717624327,0.9129124186422604,0.0021260766535441,0.8392742568061401,0.9418330122547476,0.8532352690488578,0.9971513002837108,0.9330682548178456,1189.0,4.64453125,10.0,0.9850658362989324,0.0004147642346395,0.9104895552870976,0.00310359067994,0.8331599789560169,0.944617047531734,0.8469502253826784,0.9971434133449476,0.9305771112201112,-0.00242286335516273,-0.0004430604982204045,2.0,0.9094917663110408,DO_NOT_USE_as_primary,False,False,archived_pre_split_scaler_10seed,train_only_scaler_random_row_10seed
wsn_multiseed_predictive,A,G_KD_random_pacing,10,0.985679715302491,0.0004629618325394,0.9136964790181622,0.0028063300912514,0.8411015414579879,0.9425328875625818,0.8570768640519821,0.997155221249244,0.9306158807690156,1189.0,4.64453125,10.0,0.9851814946619216,0.0006038647134979,0.910808556743555,0.0037540644559261,0.8315815659796921,0.9457949066143632,0.8493702824338261,0.9972015135250348,0.9300945151648582,-0.002887922274607213,-0.000498220640569369,2.0,0.913292082308778,DO_NOT_USE_as_primary,False,False,archived_pre_split_scaler_10seed,train_only_scaler_random_row_10seed
wsn_multiseed_predictive,A,I_KD_from_SMOTE_MLP,10,0.9855996441281138,0.0003220640569394,0.913602935164316,0.0019180099051805,0.8393421141982709,0.9488348049750192,0.8538756771339328,0.9972222019560112,0.9287398775583464,1189.0,4.64453125,10.0,0.9847081850533808,0.0008056479803346,0.9084987350325012,0.0049628134318509,0.8248233804264304,0.951274517458289,0.8467296369286498,0.9970961715043876,0.9225699688447498,-0.0051042001318147845,-0.0008914590747330919,2.0,0.9106748480189624,DO_NOT_USE_as_primary,False,False,archived_pre_split_scaler_10seed,train_only_scaler_random_row_10seed
wsn_multiseed_predictive,A,J_CoDistill_RF_CL,10,0.986514234875445,0.0006971570214189,0.9180619400289686,0.0040995322547912,0.8369788951165326,0.9526581286924553,0.8559951828115857,0.9977762015730388,0.9469012919512309,1189.0,4.64453125,,,,,,,,,,,,,,,,True,False,archived_pre_split_scaler_10seed,
wsn_multiseed_predictive,B,A_RF_500,10,0.996599644128114,5.123195746935403e-05,0.9788888430705942,0.0002514417158354,0.9903957236265056,0.9633025708283366,0.98333289531138,0.998394885464682,0.9590181401220668,,85064.5361328125,10.0,0.9965907473309608,5.943048659491634e-05,0.9788502941560824,0.0002670496364152,0.9903957236265056,0.9632084466225692,0.9832391666967846,0.9983899937124864,0.9590181401220668,-3.854891451182674e-05,-8.896797153212788e-06,2.0,0.9787577841055746,DO_NOT_USE_as_primary,False,False,archived_pre_split_scaler_10seed,train_only_scaler_random_row_10seed
wsn_multiseed_predictive,B,B_Full_MLP,10,0.9873220640569396,0.0003988504714301,0.9231949934342208,0.0023753226388243,0.8686063627222268,0.9385401593405108,0.876712653987872,0.9972290328398546,0.9348867582806392,69893.0,273.01953125,10.0,0.9872633451957296,0.000316061075401,0.9226887762531352,0.0020062386205199,0.8672306992018963,0.9383622154558102,0.8772657449747779,0.9972152442290452,0.9333699774041456,-0.0005062171810856775,-5.871886121000536e-05,2.0,0.9214800806926664,DO_NOT_USE_as_primary,False,False,archived_pre_split_scaler_10seed,train_only_scaler_random_row_10seed
wsn_multiseed_predictive,B,C2_CL_MLP_domain,10,0.9857313167259788,0.0004806543550829,0.9138075716951344,0.0031582214534915,0.8434452108985735,0.9381933485212351,0.8566409038089049,0.99715027827313,0.9336081169738282,69893.0,273.01953125,10.0,0.9856548042704628,0.0007470861411493,0.9131371118601588,0.0045405767015448,0.8425479405398836,0.936425131478382,0.8557025731807391,0.9971443729220324,0.9338655411797572,-0.0006704598349756008,-7.651245551598684e-05,2.0,0.911090216478642,DO_NOT_USE_as_primary,False,False,archived_pre_split_scaler_10seed,train_only_scaler_random_row_10seed
wsn_multiseed_predictive,B,C_CL_MLP_loss,10,0.9858861209964414,0.0006486149542669,0.9147295397337878,0.0039033725301293,0.848594642951632,0.9373032805386472,0.8557640458693282,0.9971758813919612,0.9348098479173697,69893.0,273.01953125,10.0,0.9857259786476869,0.0006639657720638,0.9135861700874944,0.0038551845773975,0.8445725592575479,0.9366087541879942,0.8558451708410644,0.9971551998336606,0.9337491663172052,-0.0011433696462933574,-0.0001601423487544995,2.0,0.9118642964555828,DO_NOT_USE_as_primary,False,False,archived_pre_split_scaler_10seed,train_only_scaler_random_row_10seed
wsn_multiseed_predictive,B,C_CL_MLP_loss_ext,10,0.9786672597864768,0.0237895490864476,0.8672566232448489,0.1548196369474477,0.7735441223368222,0.9193659665323206,0.7793706599142542,0.9960293978633354,0.8679729695775121,69893.0,273.01953125,10.0,0.9785907473309609,0.0252353803987912,0.8674204900984448,0.1616812906197555,0.7702994816450504,0.922391975220462,0.7795825971424906,0.9960697254158462,0.8687586710683748,0.00016386685359592867,-7.651245551598684e-05,2.0,0.9204200327445308,DO_NOT_USE_as_primary,False,False,archived_pre_split_scaler_10seed,train_only_scaler_random_row_10seed
wsn_multiseed_predictive,B,C_CL_MLP_loss_fair,10,0.9858861209964414,0.0006486149542669,0.9147295397337878,0.0039033725301293,0.848594642951632,0.9373032805386472,0.8557640458693282,0.9971758813919612,0.9348098479173697,69893.0,273.01953125,10.0,0.9857259786476869,0.0006639657720638,0.9135861700874944,0.0038551845773975,0.8445725592575479,0.9366087541879942,0.8558451708410644,0.9971551998336606,0.9337491663172052,-0.0011433696462933574,-0.0001601423487544995,2.0,0.9118642964555828,DO_NOT_USE_as_primary,False,False,archived_pre_split_scaler_10seed,train_only_scaler_random_row_10seed
wsn_multiseed_predictive,B,D_Small_MLP,10,0.9888345195729537,0.0006369634567679,0.9321689869057276,0.0037504644019022,0.8912192458928644,0.9411302600914764,0.8979203716332224,0.9972920587991868,0.933282998111888,3397.0,13.26953125,10.0,0.988729537366548,0.0010372035883769,0.9313411490547344,0.0065751066818356,0.8871714288930086,0.9415619407061746,0.8966085626320854,0.9973314408469528,0.9340323721954508,-0.0008278378509931628,-0.00010498220640564604,2.0,0.9382474060851552,DO_NOT_USE_as_primary,False,False,archived_pre_split_scaler_10seed,train_only_scaler_random_row_10seed
wsn_multiseed_predictive,B,E2_KD_from_MLP,10,0.9880676156583632,0.0010782448341362,0.9275475829152056,0.0068212425818299,0.8792321437482057,0.9407655171604498,0.8873973036748725,0.9972733590306564,0.9330695909618436,3397.0,13.26953125,10.0,0.986432384341637,0.0007611023781676,0.9177373468634772,0.0045751764188045,0.8531035010945003,0.9412052528103934,0.8652907348454754,0.9972448065872416,0.9318424389797756,-0.009810236051728372,-0.00163523131672616,2.0,0.9232632985246614,DO_NOT_USE_as_primary,False,False,archived_pre_split_scaler_10seed,train_only_scaler_random_row_10seed
wsn_multiseed_predictive,B,E_KD_from_RF,10,0.9891138790035588,0.0012482888073248,0.9328081908495188,0.0075896541033712,0.8731863403138209,0.9530204846521936,0.8886956487140691,0.9980210671913488,0.9511174133761616,3397.0,13.26953125,10.0,0.9901886120996444,0.0021245813221616,0.939173439381416,0.0129146695416726,0.8865939549965673,0.9533771353583076,0.902533672220508,0.9980989785677956,0.9552634557639008,0.0063652485318971275,0.0010747330960855228,2.0,0.9557232351002496,DO_NOT_USE_as_primary,False,False,archived_pre_split_scaler_10seed,train_only_scaler_random_row_10seed
wsn_multiseed_predictive,B,F_KD_from_CL_MLP,10,0.9877491103202848,0.000582763983107,0.9258158079412458,0.0034233056660401,0.8756673179358477,0.9398754187942192,0.8819514976289524,0.9972516984156832,0.9343331069315258,3397.0,13.26953125,10.0,0.9862099644128112,0.0007781858489263,0.9165800629470008,0.0050700085644064,0.8474912422374953,0.9422874941699172,0.8628107716787425,0.9972437951797272,0.9330670114691216,-0.009235744994245065,-0.0015391459074736158,2.0,0.9212766304617588,DO_NOT_USE_as_primary,False,False,archived_pre_split_scaler_10seed,train_only_scaler_random_row_10seed
wsn_multiseed_predictive,B,F_KD_from_CL_MLP_ext,10,0.9855284697508896,0.006660934290132,0.9172065778094864,0.0259049486962762,0.8716766604645547,0.9370645003333608,0.8827847634292901,0.9960784383121796,0.8984285265080469,3397.0,13.26953125,10.0,0.9830925266903916,0.0104904126824325,0.9045384603426354,0.0420776047449128,0.847562680278689,0.941690901828161,0.8544115413714513,0.9961109469062942,0.8829162313285812,-0.012668117466851037,-0.0024359430604979915,2.0,0.9171550460479372,DO_NOT_USE_as_primary,False,False,archived_pre_split_scaler_10seed,train_only_scaler_random_row_10seed
wsn_multiseed_predictive,B,F_KD_from_CL_MLP_fair,10,0.9877491103202848,0.000582763983107,0.9258158079412458,0.0034233056660401,0.8756673179358477,0.9398754187942192,0.8819514976289524,0.9972516984156832,0.9343331069315258,3397.0,13.26953125,10.0,0.9862099644128112,0.0007781858489263,0.9165800629470008,0.0050700085644064,0.8474912422374953,0.9422874941699172,0.8628107716787425,0.9972437951797272,0.9330670114691216,-0.009235744994245065,-0.0015391459074736158,2.0,0.9212766304617588,DO_NOT_USE_as_primary,False,False,archived_pre_split_scaler_10seed,train_only_scaler_random_row_10seed
wsn_multiseed_predictive,B,G_KD_random_pacing,10,0.9875213523131674,0.000914737861522,0.9246030466320788,0.0055032315800548,0.8709259669006686,0.942384935469732,0.8796795335319798,0.9972497134505606,0.9327750838074536,3397.0,13.26953125,10.0,0.9861387900355872,0.0008089945485944,0.9166090054476952,0.0048973413737985,0.8503403317713639,0.9432198372296609,0.8619253673638715,0.9971679999826156,0.9303914908909632,-0.007994041184383627,-0.0013825622775801572,2.0,0.9193547168158446,DO_NOT_USE_as_primary,False,False,archived_pre_split_scaler_10seed,train_only_scaler_random_row_10seed
wsn_multiseed_predictive,B,I_KD_from_SMOTE_MLP,10,0.9883024911032028,0.0013640435234463,0.929977731983204,0.0083109721277835,0.8824809336428204,0.950382601846657,0.8914944623932639,0.997255635002898,0.9282750270303792,3397.0,13.26953125,10.0,0.9863540925266904,0.0014065933526226,0.9175610787186456,0.008771972331587,0.8473877606024749,0.94975418072814,0.8670726021776783,0.9972655018370282,0.926325348247906,-0.01241665326455843,-0.0019483985765124112,2.0,0.9136730511416628,DO_NOT_USE_as_primary,False,False,archived_pre_split_scaler_10seed,train_only_scaler_random_row_10seed
wsn_multiseed_predictive,B,J_CoDistill_RF_CL,10,0.9891334519572954,0.0018487373226269,0.933525545706218,0.0113612254143067,0.8783420894707801,0.9521900710211753,0.8910651649890836,0.9978666269304804,0.9481637761195708,3397.0,13.26953125,,,,,,,,,,,,,,,,True,False,archived_pre_split_scaler_10seed,

Results - quickModeOFF (v2.3)/Jupyter_Output.md

# 10 -

Seed 456 summary (macro F1):
  A_RF_500                  0.9789
  B_Full_MLP                0.9253
  C_CL_MLP_loss_fair        0.9181
  C_CL_MLP_loss_ext         0.9215
  C_CL_MLP_loss             0.9181
  C2_CL_MLP_domain          0.9133
  D_Small_MLP               0.9125
  E_KD_from_RF              0.9193
  E2_KD_from_MLP            0.9164
  F_KD_from_CL_MLP_fair     0.9124
  F_KD_from_CL_MLP_ext      0.9137
  F_KD_from_CL_MLP          0.9124
  G_KD_random_pacing        0.9108
  I_KD_from_SMOTE_MLP       0.9164

Seed 789 summary (macro F1):
  A_RF_500                  0.9788
  B_Full_MLP                0.9216
  C_CL_MLP_loss_fair        0.9110
  C_CL_MLP_loss_ext         0.9159
  C_CL_MLP_loss             0.9110
  C2_CL_MLP_domain          0.9109
  D_Small_MLP               0.9136
  E_KD_from_RF              0.9194
  E2_KD_from_MLP            0.9123
  F_KD_from_CL_MLP_fair     0.9149
  F_KD_from_CL_MLP_ext      0.9110
  F_KD_from_CL_MLP          0.9149
  G_KD_random_pacing        0.9130
  I_KD_from_SMOTE_MLP       0.9204

# 11 -

Does KD beat scratch? (F vs D)
  F_KD_from_CL_MLP: 0.9123
  D_Small_MLP: 0.9120
  diff: +0.0002  |  p=1.0  |  not significant